{
  "$schema": "https://json-schema.org/draft/2020-12/schema",
  "$id": "https://nex-platform.local/schemas/service/nex_ae_api/generated_response.v1.schema.json",
  "title": "NeX AE Owner-Scoped Generated Response",
  "type": "object",
  "additionalProperties": false,
  "required": [
    "response_schema_version",
    "interaction_id",
    "chat_document_id",
    "response_id",
    "cx_generation_id",
    "content_type",
    "content",
    "content_sha256",
    "size_bytes",
    "lineage",
    "owner_scope_enforced"
  ],
  "properties": {
    "response_schema_version": {"const": "ae_generated_response.v1"},
    "interaction_id": {"type": "string", "minLength": 1},
    "chat_document_id": {"type": "string", "minLength": 1},
    "response_id": {"type": "string", "minLength": 1},
    "cx_generation_id": {"type": "string", "minLength": 1},
    "content_type": {"type": "string", "pattern": "^text/", "maxLength": 120},
    "content": {"type": "string"},
    "content_sha256": {"type": "string", "pattern": "^[0-9a-f]{64}$"},
    "size_bytes": {"type": "integer", "minimum": 0},
    "lineage": {"$ref": "#/$defs/generatedResponseLineage"},
    "owner_scope_enforced": {"const": true}
  },
  "$defs": {
    "generatedResponseLineage": {
      "type": "object",
      "additionalProperties": false,
      "required": [
        "lineage_schema_version", "response_id", "lineage_type",
        "interaction_id", "chat_document_id", "cx_generation_id", "cx_job_id",
        "content_type", "content_sha256", "size_bytes", "content_available",
        "retrieval_package_id", "retrieval_package_hash", "structured_draft_id",
        "citation_workflow_status", "bounded_repair_applied",
        "parent_interaction_id", "parent_response_id", "owner_scope_enforced",
        "raw_content_included", "storage_ref_included"
      ],
      "properties": {
        "lineage_schema_version": {"const": "ae_generated_response_lineage.v1"},
        "response_id": {"type": "string", "minLength": 1},
        "lineage_type": {"enum": ["ORIGINAL", "RETRY_CHILD"]},
        "interaction_id": {"type": "string", "minLength": 1},
        "chat_document_id": {"type": "string", "minLength": 1},
        "cx_generation_id": {"type": "string", "minLength": 1},
        "cx_job_id": {"type": "string", "minLength": 1},
        "content_type": {"type": "string", "pattern": "^text/", "maxLength": 120},
        "content_sha256": {"type": "string", "pattern": "^[0-9a-f]{64}$"},
        "size_bytes": {"type": "integer", "minimum": 0},
        "content_available": {"const": true},
        "retrieval_package_id": {"type": ["string", "null"], "minLength": 1},
        "retrieval_package_hash": {"type": ["string", "null"], "pattern": "^[0-9a-f]{64}$"},
        "structured_draft_id": {"type": ["string", "null"], "minLength": 1},
        "citation_workflow_status": {"enum": ["NOT_REQUIRED", "VALIDATED", "REPAIRED", "ATTENTION_REQUIRED"]},
        "bounded_repair_applied": {"type": "boolean"},
        "cx_grounding_lineage": {
          "anyOf": [
            {"type": "null"},
            {"$ref": "#/$defs/cxGroundingLineage"}
          ]
        },
        "parent_interaction_id": {"type": ["string", "null"], "minLength": 1},
        "parent_response_id": {"type": ["string", "null"], "minLength": 1},
        "owner_scope_enforced": {"const": true},
        "raw_content_included": {"const": false},
        "storage_ref_included": {"const": false}
      },
      "allOf": [
        {
          "if": {"properties": {"lineage_type": {"const": "ORIGINAL"}}},
          "then": {"properties": {"parent_interaction_id": {"const": null}, "parent_response_id": {"const": null}}},
          "else": {"properties": {"parent_interaction_id": {"type": "string", "minLength": 1}}}
        },
        {
          "if": {"properties": {"citation_workflow_status": {"const": "REPAIRED"}}},
          "then": {"properties": {"bounded_repair_applied": {"const": true}}},
          "else": {"properties": {"bounded_repair_applied": {"const": false}}}
        }
      ]
    },
    "cxGroundingLineage": {
      "type": "object",
      "additionalProperties": false,
      "required": [
        "lineage_schema_version", "retrieval_package_id",
        "retrieval_package_hash", "evidence_binding_hash",
        "selected_evidence_count", "citation_validation_status",
        "citation_repair_attempted", "citation_repair_attempt_count",
        "original_provider_prompt_package_hash",
        "effective_provider_prompt_package_hash", "same_retrieval_package",
        "private_evidence_included"
      ],
      "properties": {
        "lineage_schema_version": {"const": "cx_grounded_generation_lineage.v1"},
        "retrieval_package_id": {"type": "string", "minLength": 1, "maxLength": 256},
        "retrieval_package_hash": {"$ref": "#/$defs/sha256"},
        "evidence_binding_hash": {"$ref": "#/$defs/sha256"},
        "selected_evidence_count": {"type": "integer", "minimum": 1},
        "citation_validation_status": {"const": "VALIDATED"},
        "citation_repair_attempted": {"type": "boolean"},
        "citation_repair_attempt_count": {"type": "integer", "minimum": 0, "maximum": 1},
        "original_provider_prompt_package_hash": {"$ref": "#/$defs/sha256"},
        "effective_provider_prompt_package_hash": {"$ref": "#/$defs/sha256"},
        "same_retrieval_package": {"const": true},
        "private_evidence_included": {"const": false}
      }
    },
    "sha256": {"type": "string", "pattern": "^[0-9a-f]{64}$"}
  }
}
