{
  "response_schema_version": "ae_generated_response.v1",
  "interaction_id": "interaction-owner-001",
  "chat_document_id": "chat-document-owner-001",
  "response_id": "response-owner-001",
  "cx_generation_id": "cx-generation-owner-001",
  "content_type": "text/plain; charset=utf-8",
  "content": "Owner result [1].",
  "content_sha256": "1a0de4172a5580522db1c229db511fbf3cd5ef0b7025b68baafa40217715f85c",
  "size_bytes": 17,
  "lineage": {
    "lineage_schema_version": "ae_generated_response_lineage.v1",
    "response_id": "response-owner-001",
    "lineage_type": "ORIGINAL",
    "interaction_id": "interaction-owner-001",
    "chat_document_id": "chat-document-owner-001",
    "cx_generation_id": "cx-generation-owner-001",
    "cx_job_id": "cx-job-owner-001",
    "content_type": "text/plain; charset=utf-8",
    "content_sha256": "1a0de4172a5580522db1c229db511fbf3cd5ef0b7025b68baafa40217715f85c",
    "size_bytes": 17,
    "content_available": true,
    "retrieval_package_id": null,
    "retrieval_package_hash": null,
    "structured_draft_id": null,
    "citation_workflow_status": "NOT_REQUIRED",
    "bounded_repair_applied": false,
    "cx_grounding_lineage": null,
    "parent_interaction_id": null,
    "parent_response_id": null,
    "owner_scope_enforced": true,
    "raw_content_included": false,
    "storage_ref_included": false
  },
  "owner_scope_enforced": true
}
